{
  "id": "mw:recipe:oshb:wlc",
  "version": "1.0.0",
  "specVersion": "0.1",
  "source": {
    "kind": "filesystem",
    "path": "source/source-manifest.json",
    "sha256": "97eef4819aea695324e1f5ceeae5355b6df1943e888a6359dec72ebb5302ad01",
    "byte_size": 8146,
    "media_type": "application/json"
  },
  "implementation": {
    "module": "recipe.ts",
    "parserVersion": "oshb-osis-1",
    "normalizerVersion": "identity-1",
    "mapperVersion": "1",
    "validatorVersion": "1"
  },
  "output": { "path": "../../../dist/ingestion/oshb-wlc.jsonl" }
}
