{
  "id": "mw:recipe:ancient-egypt:book-of-dead:budge",
  "version": "1.0.0",
  "specVersion": "0.1",
  "source": {
    "kind": "http",
    "url": "https://www.gutenberg.org/cache/epub/7145/pg7145.txt",
    "sha256": "UNPINNED_REMOTE_ACQUISITION",
    "media_type": "text/plain; charset=utf-8"
  },
  "implementation": {
    "module": "recipe.ts",
    "parserVersion": "1",
    "normalizerVersion": "identity-1",
    "mapperVersion": "1",
    "validatorVersion": "1"
  },
  "output": {
    "path": "../../../dist/ingestion/ancient-egypt-book-of-dead-budge.jsonl"
  }
}
