{
  "id":"mw:recipe:example:lines",
  "version":"0.1.0",
  "specVersion":"0.1",
  "source":{"kind":"filesystem","path":"source.txt","sha256":"e49c81e2d2f84e259d40e2fb8192f3bcd198b355184845d76d8f58807d0d78ee","byte_size":11,"media_type":"text/plain"},
  "implementation":{"module":"recipe.ts","parserVersion":"1","normalizerVersion":"1","mapperVersion":"1","validatorVersion":"1"},
  "overlays":["curation/overlay.json"],
  "output":{"path":"../../../dist/ingestion/example-lines.jsonl"}
}
