{
  "id": "mw:recipe:ancient-egyptian:book-dead-renouf-1904",
  "version": "1.0.0",
  "specVersion": "0.1",
  "source": {
    "kind": "http",
    "url": "https://www.gutenberg.org/cache/epub/69566/pg69566.txt",
    "sha256": "runtime-verified",
    "media_type": "text/plain"
  },
  "implementation": {
    "module": "recipe.ts",
    "parserVersion": "1",
    "normalizerVersion": "identity-1",
    "mapperVersion": "1",
    "validatorVersion": "1"
  },
  "output": {
    "path": "../../../dist/ingestion/ancient-egypt-book-dead-renouf-1904.jsonl"
  }
}
